{
  "$schema": "../../schemas/figma-color-variable-reconciliation-capture.schema.json",
  "schemaVersion": "1.0.0",
  "id": "IOS-003.3-FIGMA-COLOR-VARIABLE-CAPTURE",
  "milestone": "IOS-003.3",
  "status": "ready-for-approval",
  "capturedAt": "2026-08-05T18:15:42Z",
  "operator": {
    "name": "Codex",
    "mechanism": "Authenticated Figma Plugin API integration",
    "authenticated": true
  },
  "sourceRevision": {
    "gitCommit": "202250f3578bbba33f118508062e0acd2bd4d924",
    "worktreeState": "dirty-uncommitted"
  },
  "file": {
    "key": "OJqxFKoGjRh4rrSZCKdkzi",
    "name": "InterfaceOS — Design System",
    "pageId": "2:4",
    "pageName": "03 Foundations"
  },
  "figmaRevision": {
    "status": "unavailable",
    "value": null,
    "reason": "The authenticated integration does not expose a verified Figma revision identifier."
  },
  "library": {
    "collectionPublishingHidden": true,
    "publishAction": "not-invoked",
    "publicationEvidenceRequirement": "unpublished-library-state",
    "fileSharingPermissionsGovernance": "separate-from-library-publication",
    "publicationStateVerification": "human-confirmed-unpublished",
    "humanConfirmation": {
      "reviewer": "Jai Singh — Interim Design System Owner",
      "confirmedDate": "2026-08-06",
      "statement": "The InterfaceOS library has not been published.",
      "evidenceType": "human-attestation-and-screenshot",
      "screenshotStatus": "captured",
      "screenshotPath": "evidence/screenshots/ios-003-3/library-unpublished.png",
      "screenshotSha256": "13a7ef901e9e81a2b526d024b35870ed015697994bb0e687a05657f3248904e4",
      "limitation": "The captured Figma Manage libraries interface shows an available Publish action, proving the current library is unpublished; the Plugin API does not expose publication history."
    }
  },
  "baseline": {
    "capturePath": "evidence/figma/ios-003-1-color-variables.capture.json",
    "preservedVariableCount": 80
  },
  "collections": [
    {
      "name": "Primitive",
      "collectionId": "VariableCollectionId:63:14",
      "modes": [
        {
          "name": "Mode 1",
          "modeId": "63:0"
        }
      ],
      "colorVariableCount": 100
    },
    {
      "name": "Semantic",
      "collectionId": "VariableCollectionId:63:15",
      "modes": [
        {
          "name": "Mode 1",
          "modeId": "63:1"
        }
      ],
      "colorVariableCount": 35
    },
    {
      "name": "Theme",
      "collectionId": "VariableCollectionId:63:16",
      "modes": [
        {
          "name": "Light",
          "modeId": "63:2"
        },
        {
          "name": "Dark",
          "modeId": "63:5"
        }
      ],
      "colorVariableCount": 35
    },
    {
      "name": "Responsive",
      "collectionId": "VariableCollectionId:63:17",
      "modes": [
        {
          "name": "Mode 1",
          "modeId": "63:3"
        }
      ],
      "colorVariableCount": 0
    },
    {
      "name": "Motion",
      "collectionId": "VariableCollectionId:63:18",
      "modes": [
        {
          "name": "Mode 1",
          "modeId": "63:4"
        }
      ],
      "colorVariableCount": 0
    }
  ],
  "createdVariables": [
    {
      "canonicalTokenPath": "color.primitive.neutral.400",
      "figmaName": "color/primitive/neutral/400",
      "variableId": "VariableID:127:14",
      "collection": "Primitive",
      "collectionId": "VariableCollectionId:63:14",
      "variableType": "COLOR",
      "scopes": ["ALL_FILLS", "STROKE_COLOR", "EFFECT_COLOR"],
      "codeSyntax": "var(--ios-color-primitive-neutral-400)",
      "modeBindings": {
        "storage": {
          "kind": "direct",
          "canonicalTokenPath": "color.primitive.neutral.400"
        }
      }
    },
    {
      "canonicalTokenPath": "color.primitive.neutral.600",
      "figmaName": "color/primitive/neutral/600",
      "variableId": "VariableID:127:15",
      "collection": "Primitive",
      "collectionId": "VariableCollectionId:63:14",
      "variableType": "COLOR",
      "scopes": ["ALL_FILLS", "STROKE_COLOR", "EFFECT_COLOR"],
      "codeSyntax": "var(--ios-color-primitive-neutral-600)",
      "modeBindings": {
        "storage": {
          "kind": "direct",
          "canonicalTokenPath": "color.primitive.neutral.600"
        }
      }
    },
    {
      "canonicalTokenPath": "color.primitive.blue.100",
      "figmaName": "color/primitive/blue/100",
      "variableId": "VariableID:127:16",
      "collection": "Primitive",
      "collectionId": "VariableCollectionId:63:14",
      "variableType": "COLOR",
      "scopes": ["ALL_FILLS", "STROKE_COLOR", "EFFECT_COLOR"],
      "codeSyntax": "var(--ios-color-primitive-blue-100)",
      "modeBindings": {
        "storage": {
          "kind": "direct",
          "canonicalTokenPath": "color.primitive.blue.100"
        }
      }
    },
    {
      "canonicalTokenPath": "color.primitive.blue.300",
      "figmaName": "color/primitive/blue/300",
      "variableId": "VariableID:127:17",
      "collection": "Primitive",
      "collectionId": "VariableCollectionId:63:14",
      "variableType": "COLOR",
      "scopes": ["ALL_FILLS", "STROKE_COLOR", "EFFECT_COLOR"],
      "codeSyntax": "var(--ios-color-primitive-blue-300)",
      "modeBindings": {
        "storage": {
          "kind": "direct",
          "canonicalTokenPath": "color.primitive.blue.300"
        }
      }
    },
    {
      "canonicalTokenPath": "color.primitive.blue.500",
      "figmaName": "color/primitive/blue/500",
      "variableId": "VariableID:127:18",
      "collection": "Primitive",
      "collectionId": "VariableCollectionId:63:14",
      "variableType": "COLOR",
      "scopes": ["ALL_FILLS", "STROKE_COLOR", "EFFECT_COLOR"],
      "codeSyntax": "var(--ios-color-primitive-blue-500)",
      "modeBindings": {
        "storage": {
          "kind": "direct",
          "canonicalTokenPath": "color.primitive.blue.500"
        }
      }
    },
    {
      "canonicalTokenPath": "color.primitive.blue.950",
      "figmaName": "color/primitive/blue/950",
      "variableId": "VariableID:127:19",
      "collection": "Primitive",
      "collectionId": "VariableCollectionId:63:14",
      "variableType": "COLOR",
      "scopes": ["ALL_FILLS", "STROKE_COLOR", "EFFECT_COLOR"],
      "codeSyntax": "var(--ios-color-primitive-blue-950)",
      "modeBindings": {
        "storage": {
          "kind": "direct",
          "canonicalTokenPath": "color.primitive.blue.950"
        }
      }
    },
    {
      "canonicalTokenPath": "color.primitive.green.100",
      "figmaName": "color/primitive/green/100",
      "variableId": "VariableID:127:20",
      "collection": "Primitive",
      "collectionId": "VariableCollectionId:63:14",
      "variableType": "COLOR",
      "scopes": ["ALL_FILLS", "STROKE_COLOR", "EFFECT_COLOR"],
      "codeSyntax": "var(--ios-color-primitive-green-100)",
      "modeBindings": {
        "storage": {
          "kind": "direct",
          "canonicalTokenPath": "color.primitive.green.100"
        }
      }
    },
    {
      "canonicalTokenPath": "color.primitive.green.300",
      "figmaName": "color/primitive/green/300",
      "variableId": "VariableID:127:21",
      "collection": "Primitive",
      "collectionId": "VariableCollectionId:63:14",
      "variableType": "COLOR",
      "scopes": ["ALL_FILLS", "STROKE_COLOR", "EFFECT_COLOR"],
      "codeSyntax": "var(--ios-color-primitive-green-300)",
      "modeBindings": {
        "storage": {
          "kind": "direct",
          "canonicalTokenPath": "color.primitive.green.300"
        }
      }
    },
    {
      "canonicalTokenPath": "color.primitive.green.400",
      "figmaName": "color/primitive/green/400",
      "variableId": "VariableID:127:22",
      "collection": "Primitive",
      "collectionId": "VariableCollectionId:63:14",
      "variableType": "COLOR",
      "scopes": ["ALL_FILLS", "STROKE_COLOR", "EFFECT_COLOR"],
      "codeSyntax": "var(--ios-color-primitive-green-400)",
      "modeBindings": {
        "storage": {
          "kind": "direct",
          "canonicalTokenPath": "color.primitive.green.400"
        }
      }
    },
    {
      "canonicalTokenPath": "color.primitive.green.500",
      "figmaName": "color/primitive/green/500",
      "variableId": "VariableID:127:23",
      "collection": "Primitive",
      "collectionId": "VariableCollectionId:63:14",
      "variableType": "COLOR",
      "scopes": ["ALL_FILLS", "STROKE_COLOR", "EFFECT_COLOR"],
      "codeSyntax": "var(--ios-color-primitive-green-500)",
      "modeBindings": {
        "storage": {
          "kind": "direct",
          "canonicalTokenPath": "color.primitive.green.500"
        }
      }
    },
    {
      "canonicalTokenPath": "color.primitive.green.700",
      "figmaName": "color/primitive/green/700",
      "variableId": "VariableID:127:24",
      "collection": "Primitive",
      "collectionId": "VariableCollectionId:63:14",
      "variableType": "COLOR",
      "scopes": ["ALL_FILLS", "STROKE_COLOR", "EFFECT_COLOR"],
      "codeSyntax": "var(--ios-color-primitive-green-700)",
      "modeBindings": {
        "storage": {
          "kind": "direct",
          "canonicalTokenPath": "color.primitive.green.700"
        }
      }
    },
    {
      "canonicalTokenPath": "color.primitive.green.900",
      "figmaName": "color/primitive/green/900",
      "variableId": "VariableID:127:25",
      "collection": "Primitive",
      "collectionId": "VariableCollectionId:63:14",
      "variableType": "COLOR",
      "scopes": ["ALL_FILLS", "STROKE_COLOR", "EFFECT_COLOR"],
      "codeSyntax": "var(--ios-color-primitive-green-900)",
      "modeBindings": {
        "storage": {
          "kind": "direct",
          "canonicalTokenPath": "color.primitive.green.900"
        }
      }
    },
    {
      "canonicalTokenPath": "color.primitive.red.100",
      "figmaName": "color/primitive/red/100",
      "variableId": "VariableID:127:26",
      "collection": "Primitive",